[
  {
    "schema_version": "1.0.0",
    "item_id": "MISC_001_B_0011_01",
    "entity": {
      "entity_type": "Trading Card",
      "sport": "Baseball"
    },
    "images": {
      "front": {
        "filename": "MISC_001_B_0011_01_a.jpg",
        "path": null
      },
      "back": {
        "filename": "MISC_001_B_0011_01_b.jpg",
        "path": null
      }
    },
    "card": {
      "year": 1994,
      "manufacturer": "Upper Deck",
      "brand": "Upper Deck",
      "set": "Upper Deck Top Prospects",
      "subset": null,
      "title": null,
      "card_number": "542",
      "language": "English",
      "copyright": "(c) 1994 The Upper Deck Company"
    },
    "subjects": [
      {
        "type": "player",
        "name": "Mike Bell",
        "team": "Texas Rangers",
        "position": "3B"
      }
    ],
    "attributes": {
      "classification": "Base",
      "rookie": true,
      "parallel": false,
      "autograph": false,
      "memorabilia": false,
      "serial_numbered": false
    },
    "condition": {
      "overall": null,
      "observations": []
    },
    "ocr": {
      "front": "MIKE BELL UPPER DECK TOP PROSPECTS",
      "back": "542 MIKE BELL HT: 6'2\" WT: 185 BATS: R THROWS: R BORN: 12-7-74 Cincinnati, Ohio ... (c) 1994 The Upper Deck Company. All Rights Reserved. Printed in the U.S.A."
    },
    "notes": [],
    "pipeline": {
      "batch": "batch0010_raw",
      "extractor": "GPT-5.3-Codex",
      "confidence": "High",
      "review_required": false
    }
  },
  {
    "schema_version": "1.0.0",
    "item_id": "MISC_001_B_0011_02",
    "entity": {
      "entity_type": "Trading Card",
      "sport": "Baseball"
    },
    "images": {
      "front": {
        "filename": "MISC_001_B_0011_02_a.jpg",
        "path": null
      },
      "back": {
        "filename": "MISC_001_B_0011_02_b.jpg",
        "path": null
      }
    },
    "card": {
      "year": 1994,
      "manufacturer": "Upper Deck",
      "brand": "Upper Deck",
      "set": "Upper Deck Top Prospects",
      "subset": null,
      "title": null,
      "card_number": "546",
      "language": "English",
      "copyright": "(c) 1994 The Upper Deck Company"
    },
    "subjects": [
      {
        "type": "player",
        "name": "Johnny Damon",
        "team": "Kansas City Royals",
        "position": "OF"
      }
    ],
    "attributes": {
      "classification": "Base",
      "rookie": true,
      "parallel": false,
      "autograph": false,
      "memorabilia": false,
      "serial_numbered": false
    },
    "condition": {
      "overall": null,
      "observations": []
    },
    "ocr": {
      "front": "JOHNNY DAMON UPPER DECK TOP PROSPECTS KC",
      "back": "546 JOHNNY DAMON HT: 6'0\" WT: 175 BATS: L THROWS: L BORN: 11-5-73 Fort Riley, Kansas ... (c) 1994 The Upper Deck Company. All Rights Reserved. Printed in the U.S.A."
    },
    "notes": [],
    "pipeline": {
      "batch": "batch0010_raw",
      "extractor": "GPT-5.3-Codex",
      "confidence": "High",
      "review_required": false
    }
  },
  {
    "schema_version": "1.0.0",
    "item_id": "MISC_001_C_0001_01",
    "entity": {
      "entity_type": "Trading Card",
      "sport": "Baseball"
    },
    "images": {
      "front": {
        "filename": "MISC_001_C_0001_01_a.jpg",
        "path": null
      },
      "back": {
        "filename": "MISC_001_C_0001_01_b.jpg",
        "path": null
      }
    },
    "card": {
      "year": 1981,
      "manufacturer": "Topps",
      "brand": "Topps",
      "set": "Topps Baseball",
      "subset": "A.L. All-Star",
      "title": null,
      "card_number": "700",
      "language": "English",
      "copyright": "(c) 1981 Topps Chewing Gum, Inc."
    },
    "subjects": [
      {
        "type": "player",
        "name": "George Brett",
        "team": "Kansas City Royals",
        "position": "3rd base"
      }
    ],
    "attributes": {
      "classification": "Base",
      "rookie": false,
      "parallel": false,
      "autograph": false,
      "memorabilia": false,
      "serial_numbered": false
    },
    "condition": {
      "overall": null,
      "observations": []
    },
    "ocr": {
      "front": "A.L. ALL-STAR 3rd BASE ROYALS GEORGE BRETT",
      "back": "Topps 700 GEORGE BRETT 3rd base ... COMPLETE MAJOR LEAGUE BATTING RECORD ... (c) 1981 TOPPS CHEWING GUM, INC."
    },
    "notes": [],
    "pipeline": {
      "batch": "batch0010_raw",
      "extractor": "GPT-5.3-Codex",
      "confidence": "High",
      "review_required": false
    }
  },
  {
    "schema_version": "1.0.0",
    "item_id": "MISC_001_C_0001_02",
    "entity": {
      "entity_type": "Trading Card",
      "sport": "Baseball"
    },
    "images": {
      "front": {
        "filename": "MISC_001_C_0001_02_a.jpg",
        "path": null
      },
      "back": {
        "filename": "MISC_001_C_0001_02_b.jpg",
        "path": null
      }
    },
    "card": {
      "year": 1993,
      "manufacturer": "Upper Deck",
      "brand": "Upper Deck",
      "set": "The Upper Deck Looss Collection",
      "subset": null,
      "title": null,
      "card_number": "WI 22",
      "language": "English",
      "copyright": "(c) 1992 The Upper Deck Co."
    },
    "subjects": [
      {
        "type": "player",
        "name": "George Brett",
        "team": "Kansas City Royals",
        "position": null
      }
    ],
    "attributes": {
      "classification": "Promotional",
      "rookie": false,
      "parallel": false,
      "autograph": false,
      "memorabilia": false,
      "serial_numbered": false
    },
    "condition": {
      "overall": null,
      "observations": []
    },
    "ocr": {
      "front": "The Upper Deck looss Collection",
      "back": "WI 22 \"George asked where I wanted to take the picture...\" GEORGE BRETT ... Upper Deck and the card/hologram combination are trademarks of The Upper Deck Company."
    },
    "notes": [],
    "pipeline": {
      "batch": "batch0010_raw",
      "extractor": "GPT-5.3-Codex",
      "confidence": "High",
      "review_required": false
    }
  }
]
