[
  {
    "schema_version": "1.0.0",
    "item_id": "T_001_E_017_01",
    "entity": {
      "entity_type": "Trading Card",
      "sport": "baseball"
    },
    "images": {
      "front": {
        "filename": "T_001_E_017_01_a.jpg",
        "path": null
      },
      "back": {
        "filename": "T_001_E_017_01_b.jpg",
        "path": null
      }
    },
    "card": {
      "year": 1994,
      "manufacturer": "Topps",
      "brand": null,
      "set": "Topps",
      "subset": "Future Star",
      "title": null,
      "card_number": "251",
      "language": "English",
      "copyright": null
    },
    "subjects": [
      {
        "type": "player",
        "name": "Jose Valentin",
        "team": "Milwaukee Brewers",
        "position": null
      }
    ],
    "attributes": {
      "classification": "Base",
      "rookie": false,
      "parallel": false,
      "autograph": false,
      "memorabilia": false,
      "serial_numbered": false
    },
    "condition": {
      "overall": null,
      "observations": []
    },
    "ocr": {
      "front": "FUTURE STAR; Topps; Jose Valentin",
      "back": "251 JOSE VALENTIN"
    },
    "notes": [],
    "pipeline": {
      "batch": "batch0004",
      "extractor": "legacy-flat-v1",
      "confidence": "High",
      "review_required": false
    }
  },
  {
    "schema_version": "1.0.0",
    "item_id": "T_001_E_017_02",
    "entity": {
      "entity_type": "Trading Card",
      "sport": "baseball"
    },
    "images": {
      "front": {
        "filename": "T_001_E_017_02_a.jpg",
        "path": null
      },
      "back": {
        "filename": "T_001_E_017_02_b.jpg",
        "path": null
      }
    },
    "card": {
      "year": 1994,
      "manufacturer": "Topps",
      "brand": null,
      "set": "Topps",
      "subset": "Future Star",
      "title": null,
      "card_number": "356",
      "language": "English",
      "copyright": null
    },
    "subjects": [
      {
        "type": "player",
        "name": "Scott Ruffcorn",
        "team": "Chicago White Sox",
        "position": null
      }
    ],
    "attributes": {
      "classification": "Base",
      "rookie": false,
      "parallel": false,
      "autograph": false,
      "memorabilia": false,
      "serial_numbered": false
    },
    "condition": {
      "overall": null,
      "observations": []
    },
    "ocr": {
      "front": "FUTURE STAR; Topps; Scott Ruffcorn",
      "back": "356 SCOTT RUFFCORN"
    },
    "notes": [],
    "pipeline": {
      "batch": "batch0004",
      "extractor": "legacy-flat-v1",
      "confidence": "High",
      "review_required": false
    }
  },
  {
    "schema_version": "1.0.0",
    "item_id": "T_001_E_017_03",
    "entity": {
      "entity_type": "Trading Card",
      "sport": "baseball"
    },
    "images": {
      "front": {
        "filename": "T_001_E_017_03_a.jpg",
        "path": null
      },
      "back": {
        "filename": "T_001_E_017_03_b.jpg",
        "path": null
      }
    },
    "card": {
      "year": 1994,
      "manufacturer": "Topps",
      "brand": null,
      "set": "Topps",
      "subset": "Future Star",
      "title": null,
      "card_number": "278",
      "language": "English",
      "copyright": null
    },
    "subjects": [
      {
        "type": "player",
        "name": "Calvin Reese",
        "team": "Cincinnati Reds",
        "position": null
      }
    ],
    "attributes": {
      "classification": "Base",
      "rookie": false,
      "parallel": false,
      "autograph": false,
      "memorabilia": false,
      "serial_numbered": false
    },
    "condition": {
      "overall": null,
      "observations": []
    },
    "ocr": {
      "front": "FUTURE STAR; Topps; Calvin Reese",
      "back": "278 CALVIN REESE"
    },
    "notes": [],
    "pipeline": {
      "batch": "batch0004",
      "extractor": "legacy-flat-v1",
      "confidence": "High",
      "review_required": false
    }
  },
  {
    "schema_version": "1.0.0",
    "item_id": "T_001_E_017_04",
    "entity": {
      "entity_type": "Trading Card",
      "sport": "baseball"
    },
    "images": {
      "front": {
        "filename": "T_001_E_017_04_a.jpg",
        "path": null
      },
      "back": {
        "filename": "T_001_E_017_04_b.jpg",
        "path": null
      }
    },
    "card": {
      "year": 1994,
      "manufacturer": "Topps",
      "brand": null,
      "set": "Topps",
      "subset": "Future Star",
      "title": null,
      "card_number": "341",
      "language": "English",
      "copyright": null
    },
    "subjects": [
      {
        "type": "player",
        "name": "Nigel Wilson",
        "team": "Florida Marlins",
        "position": null
      }
    ],
    "attributes": {
      "classification": "Base",
      "rookie": false,
      "parallel": false,
      "autograph": false,
      "memorabilia": false,
      "serial_numbered": false
    },
    "condition": {
      "overall": null,
      "observations": []
    },
    "ocr": {
      "front": "FUTURE STAR; Topps; Nigel Wilson",
      "back": "341 NIGEL WILSON"
    },
    "notes": [],
    "pipeline": {
      "batch": "batch0004",
      "extractor": "legacy-flat-v1",
      "confidence": "High",
      "review_required": false
    }
  },
  {
    "schema_version": "1.0.0",
    "item_id": "T_001_E_018_04",
    "entity": {
      "entity_type": "Trading Card",
      "sport": "baseball"
    },
    "images": {
      "front": {
        "filename": "T_001_E_018_04_a.jpg",
        "path": null
      },
      "back": {
        "filename": "T_001_E_018_04_b.jpg",
        "path": null
      }
    },
    "card": {
      "year": 1994,
      "manufacturer": "Topps",
      "brand": null,
      "set": "Topps",
      "subset": "Future Star",
      "title": null,
      "card_number": "259",
      "language": "English",
      "copyright": null
    },
    "subjects": [
      {
        "type": "player",
        "name": "Cliff Floyd",
        "team": "Montreal Expos",
        "position": null
      }
    ],
    "attributes": {
      "classification": "Base",
      "rookie": false,
      "parallel": false,
      "autograph": false,
      "memorabilia": false,
      "serial_numbered": false
    },
    "condition": {
      "overall": null,
      "observations": []
    },
    "ocr": {
      "front": "FUTURE STAR; Topps; Cliff Floyd",
      "back": "259 CLIFF FLOYD"
    },
    "notes": [],
    "pipeline": {
      "batch": "batch0004",
      "extractor": "legacy-flat-v1",
      "confidence": "High",
      "review_required": false
    }
  },
  {
    "schema_version": "1.0.0",
    "item_id": "T_001_E_019_01",
    "entity": {
      "entity_type": "Trading Card",
      "sport": "baseball"
    },
    "images": {
      "front": {
        "filename": "T_001_E_019_01_a.jpg",
        "path": null
      },
      "back": {
        "filename": "T_001_E_019_01_b.jpg",
        "path": null
      }
    },
    "card": {
      "year": 1994,
      "manufacturer": "Topps",
      "brand": null,
      "set": "Topps",
      "subset": "Future Star",
      "title": null,
      "card_number": "329",
      "language": "English",
      "copyright": null
    },
    "subjects": [
      {
        "type": "player",
        "name": "Matt Walbeck",
        "team": "Chicago Cubs",
        "position": null
      }
    ],
    "attributes": {
      "classification": "Base",
      "rookie": false,
      "parallel": false,
      "autograph": false,
      "memorabilia": false,
      "serial_numbered": false
    },
    "condition": {
      "overall": null,
      "observations": []
    },
    "ocr": {
      "front": "FUTURE STAR; Topps; Matt Walbeck",
      "back": "329 MATT WALBECK"
    },
    "notes": [],
    "pipeline": {
      "batch": "batch0004",
      "extractor": "legacy-flat-v1",
      "confidence": "High",
      "review_required": false
    }
  },
  {
    "schema_version": "1.0.0",
    "item_id": "T_001_E_019_02",
    "entity": {
      "entity_type": "Trading Card",
      "sport": "baseball"
    },
    "images": {
      "front": {
        "filename": "T_001_E_019_02_a.jpg",
        "path": null
      },
      "back": {
        "filename": "T_001_E_019_02_b.jpg",
        "path": null
      }
    },
    "card": {
      "year": 1994,
      "manufacturer": "Topps",
      "brand": null,
      "set": "Topps",
      "subset": "Future Star",
      "title": null,
      "card_number": "363",
      "language": "English",
      "copyright": null
    },
    "subjects": [
      {
        "type": "player",
        "name": "Eric Helfand",
        "team": "Oakland Athletics",
        "position": null
      }
    ],
    "attributes": {
      "classification": "Base",
      "rookie": true,
      "parallel": false,
      "autograph": false,
      "memorabilia": false,
      "serial_numbered": false
    },
    "condition": {
      "overall": null,
      "observations": []
    },
    "ocr": {
      "front": "FUTURE STAR; Topps; Eric Helfand",
      "back": "363 ERIC HELFAND; ROOKIE CARD"
    },
    "notes": [],
    "pipeline": {
      "batch": "batch0004",
      "extractor": "legacy-flat-v1",
      "confidence": "High",
      "review_required": false
    }
  }
]
